{
  "artifact_mode": "checked-in",
  "artifact_paths": {
    "source": "cases/conformance/v2_0/cityjsonfeature_extension_roundtrip/cityjsonfeature_extension_roundtrip.city.jsonl"
  },
  "assertions": [
    "extensions_preserved",
    "feature_boundaries_preserved"
  ],
  "cityjson_version": "2.0",
  "correctness_class": "normative",
  "description": "Minimized CityJSONFeature conformance fixture covering extension payload preservation and feature streaming.",
  "family": "spec_atom",
  "geometry_validity": "dummy",
  "id": "cityjsonfeature_extension_roundtrip",
  "layer": "conformance",
  "representation": "cityjsonfeature",
  "source_kind": "synthetic-controlled",
  "version": 2
}
