{
  "artifact_mode": "checked-in",
  "artifact_paths": {
    "source": "cases/conformance/v2_0/geometry_templates_reuse/geometry_templates_reuse.city.json"
  },
  "assertions": [
    "instance_count_stable",
    "template_reuse_preserved"
  ],
  "cityjson_version": "2.0",
  "correctness_class": "normative",
  "description": "Minimized template conformance fixture covering repeated GeometryInstance reuse and instance count stability.",
  "family": "spec_atom",
  "geometry_validity": "dummy",
  "id": "geometry_templates_reuse",
  "layer": "conformance",
  "representation": "cityjson",
  "source_kind": "synthetic-controlled",
  "version": 2
}
