{
  "artifact_mode": "checked-in",
  "artifact_paths": {
    "source": "cases/conformance/v2_0/texture_minimal/texture_minimal.city.json"
  },
  "assertions": [
    "texture_payload_preserved"
  ],
  "cityjson_version": "2.0",
  "correctness_class": "normative",
  "description": "texture minimal conformance fixture migrated from serde_cityjson.",
  "family": "spec_atom",
  "geometry_validity": "dummy",
  "id": "texture_minimal",
  "layer": "conformance",
  "representation": "cityjson",
  "source_kind": "synthetic-controlled",
  "version": 2
}
