{
  "artifact_mode": "checked-in",
  "artifact_paths": {
    "source": "cases/conformance/v2_0/appearance_empty/appearance_empty.city.json"
  },
  "assertions": [
    "appearance_preserved"
  ],
  "cityjson_version": "2.0",
  "correctness_class": "normative",
  "description": "appearance empty conformance fixture migrated from serde_cityjson.",
  "family": "spec_atom",
  "geometry_validity": "dummy",
  "id": "appearance_empty",
  "layer": "conformance",
  "representation": "cityjson",
  "source_kind": "synthetic-controlled",
  "version": 2
}
