{
  "artifact_mode": "checked-in",
  "artifact_paths": {
    "source": "cases/conformance/v2_0/geometry_texture_multisurface/geometry_texture_multisurface.city.json"
  },
  "assertions": [
    "geometry_surface_preserved"
  ],
  "cityjson_version": "2.0",
  "correctness_class": "normative",
  "description": "geometry texture multisurface conformance fixture migrated from serde_cityjson.",
  "family": "spec_atom",
  "geometry_validity": "dummy",
  "id": "geometry_texture_multisurface",
  "layer": "conformance",
  "representation": "cityjson",
  "source_kind": "synthetic-controlled",
  "version": 2
}
