{
  "artifact_mode": "checked-in",
  "artifact_paths": {
    "source": "cases/conformance/v2_0/cityjsonfeature_root_id_resolves/cityjsonfeature_root_id_resolves.city.jsonl"
  },
  "assertions": [
    "feature_root_id_resolves",
    "feature_boundaries_preserved"
  ],
  "cityjson_version": "2.0",
  "correctness_class": "normative",
  "description": "Hand-written CityJSONFeature fixture where root id resolves to a real CityObject in the same feature.",
  "family": "spec_atom",
  "geometry_validity": "dummy",
  "id": "cityjsonfeature_root_id_resolves",
  "layer": "conformance",
  "representation": "cityjsonfeature",
  "source_kind": "synthetic-controlled",
  "version": 2
}
