{
  "artifact_mode": "generated",
  "artifact_paths": {
    "generated": "artifacts/generated/stress_attribute_tree.city.json",
    "profile": "cases/workloads/stress_attribute_tree/profile.json"
  },
  "assertions": [
    "nested_attributes_preserved",
    "allocation_shape_visible"
  ],
  "cityjson_version": "2.0",
  "documentation": "cases/workloads/stress_attribute_tree/README.md",
  "family": "stress",
  "geometry_validity": "dummy",
  "id": "stress_attribute_tree",
  "layer": "workload",
  "representation": "cityjson",
  "source_kind": "synthetic-controlled",
  "version": 2
}
